[
    {
        "_id": 28,
        "code": "TABLE-A-ID",
        "physical_name": "",
        "logical_name": "Table A ID",
        "data_type": "INTEGER",
        "column_type": "IDENTIFIER",
        "description": "",
        "_class": "COLUMN-INSTANCE"
    },
    {
        "_id": 15,
        "code": "TABLE-B-ATTR2",
        "physical_name": "",
        "logical_name": "Table B Attr2",
        "data_type": "STRING",
        "column_type": "ATTRIBUTE",
        "description": "",
        "_class": "COLUMN-INSTANCE"
    },
    {
        "_id": 14,
        "code": "TABLE-B-ATTR1",
        "physical_name": "",
        "logical_name": "Table B Attr1",
        "data_type": "STRING",
        "column_type": "ATTRIBUTE",
        "description": "",
        "_class": "COLUMN-INSTANCE"
    },
    {
        "_id": 13,
        "code": "TABLE-B-ID",
        "physical_name": "",
        "logical_name": "Table B ID",
        "data_type": "INTEGER",
        "column_type": "IDENTIFIER",
        "description": "",
        "_class": "COLUMN-INSTANCE"
    },
    {
        "_id": 12,
        "code": "TABLE-A-ATTR2",
        "physical_name": "",
        "logical_name": "Table A Attr2",
        "data_type": "STRING",
        "column_type": "ATTRIBUTE",
        "description": "",
        "_class": "COLUMN-INSTANCE"
    },
    {
        "_id": 11,
        "code": "TABLE-A-ATTR1",
        "physical_name": "",
        "logical_name": "Table A Attr1",
        "data_type": "STRING",
        "column_type": "ATTRIBUTE",
        "description": "",
        "_class": "COLUMN-INSTANCE"
    },
    {
        "_id": 10,
        "code": "TABLE-A-ID",
        "physical_name": "",
        "logical_name": "Table A ID",
        "data_type": "INTEGER",
        "column_type": "IDENTIFIER",
        "description": "",
        "_class": "COLUMN-INSTANCE"
    }
]
